{
  "$schema": "https://json-schema.org/draft/2020-12/schema",
  "type": "object",
  "properties": {
    "record_id": {
      "type": "string",
      "minLength": 1
    },
    "site_id": {
      "type": "string",
      "minLength": 1
    },
    "source_message_id": {
      "type": "string",
      "minLength": 1
    },
    "sent_at": {
      "type": "string",
      "format": "date-time",
      "pattern": "^(?:(?:\\d\\d[2468][048]|\\d\\d[13579][26]|\\d\\d0[48]|[02468][048]00|[13579][26]00)-02-29|\\d{4}-(?:(?:0[13578]|1[02])-(?:0[1-9]|[12]\\d|3[01])|(?:0[469]|11)-(?:0[1-9]|[12]\\d|30)|(?:02)-(?:0[1-9]|1\\d|2[0-8])))T(?:(?:[01]\\d|2[0-3]):[0-5]\\d:[0-5]\\d(?:\\.\\d+)?(?:Z|([+-](?:[01]\\d|2[0-3]):[0-5]\\d)))$"
    },
    "sender_raw": {
      "type": "string",
      "minLength": 1
    },
    "sender_person_id": {
      "anyOf": [
        {
          "type": "string",
          "minLength": 1
        },
        {
          "type": "null"
        }
      ]
    },
    "confidence": {
      "type": "number",
      "minimum": 0,
      "maximum": 1
    },
    "job_row_id": {
      "type": "string",
      "minLength": 1
    },
    "date": {
      "type": "string",
      "format": "date",
      "pattern": "^(?:(?:\\d\\d[2468][048]|\\d\\d[13579][26]|\\d\\d0[48]|[02468][048]00|[13579][26]00)-02-29|\\d{4}-(?:(?:0[13578]|1[02])-(?:0[1-9]|[12]\\d|3[01])|(?:0[469]|11)-(?:0[1-9]|[12]\\d|30)|(?:02)-(?:0[1-9]|1\\d|2[0-8])))$"
    },
    "reason": {
      "type": "string",
      "minLength": 1
    },
    "cause": {
      "type": "string",
      "enum": [
        "hk_standard",
        "tenant_project_event",
        "engineering_equipment",
        "spill",
        "external_other"
      ]
    }
  },
  "required": [
    "record_id",
    "site_id",
    "source_message_id",
    "sent_at",
    "sender_raw",
    "sender_person_id",
    "confidence",
    "job_row_id",
    "date",
    "reason",
    "cause"
  ],
  "additionalProperties": false
}
